id,username,review_time,book_id,title
1324,kwet6ylbrrk@deleted,2011-07-03,490,"The Moral Animal: Why We Are, the Way We Are: The New Science of Evolutio"
1860,kwet6ylbrrk@deleted,2011-07-03,724,"The Moral Animal: Why We Are, the Way We Are: The New Science of Ev - ACCEPTABLE"
2382,renae_clair,2020-01-29,948,Salamandastron: A Novel of Redwall - Mass Market
2755,cambt3,2019-04-25,1130,National Geographic Readers: Koalas
3257,jacobs68,2023-06-16,1343,Pokmon Crochet Kit: Kit includes everything you need to make Pikachu and instruc
4529,maryann774,2012-01-09,2098,The Hat
7114,jacobs68,2022-04-03,380694,Dog Heaven
9070,jacobs68,2021-07-26,138195,Animal Farm
11802,kwet6ylbrrk@deleted,2023-11-29,94293,"Rumor Has It; An Animal Magnetism Novel - Jill Shalvis, 9780425255827"
11937,renae_clair,2019-05-15,37882,Survivors #1: The Empty City
12075,jacobs68,2007-04-29,284467,Just a Mess (Little Critter) (Look-Look)
13032,jacobs68,2022-09-08,332393,Thunder on the Plains The Story of the American Buffalo
17323,cambt3,2023-06-18,386779,"Scaredy-Cat, Splat! (Splat the Cat)"
18645,kwet6ylbrrk@deleted,2019-06-26,145412,Animal Farm by George Orwell
18844,renae_clair,2023-05-08,73214,Never Touch a Shark
19992,cambt3,2021-05-19,16897,Spring Stinks (Mother Bruce Series)
20283,maryann774,2020-05-06,182705,Hoot
20693,jacobs68,2019-02-15,403141,God Gave Us Easter
20955,cambt3,2014-07-03,315493,The Berenstain Bears Around the World (I Can Read Level 1)
21082,kwet6ylbrrk@deleted,2022-07-10,152269,National Geographic Kids Chapters: Kangaroo to the Rescue!: And More True
21125,kwet6ylbrrk@deleted,2018-06-02,307991,Olivia's Opposites
21400,maryann774,2006-12-11,323510,"NEW LISTINGThe Kingfisher Animal Encyclopedia; Kingfis- David Burnie, 0753465809"
22303,jacobs68,2017-10-15,289610,The Cat Who Knew Shakespeare - Mass Market
23293,kwet6ylbrrk@deleted,2020-09-14,114188,Knight Owl
23491,kwet6ylbrrk@deleted,2023-06-05,250088,The Raft
23796,kwet6ylbrrk@deleted,2014-05-07,349086,Do Cows Meow? (A Lift-the-Flap Book)
27372,kwet6ylbrrk@deleted,2010-05-26,47570,"NEW LISTINGThe Crow: The Third Book of Pellinor by Croggon, Alison"
27523,jacobs68,2021-02-14,385641,"The Mitten, 20th Anniversary Edition"
27556,renae_clair,2023-11-04,50391,All Better!
28494,jacobs68,2019-11-14,370129,Pet Bugs: A Kid's Guide to Catching and Keeping Touchable Insects
28939,renae_clair,2021-03-31,21559,Animal-Speak: The Spiritual & Magical Powers of Creatures Great & Small
29397,maryann774,2011-10-11,371753,Baby Shark! (Little Golden Book)
30040,kwet6ylbrrk@deleted,2020-09-23,314537,The Great Rescue (Cabbage Patch Kids)
31031,maryann774,2021-07-10,155370,"Skippyjon Jones, Class Action"
31149,maryann774,2023-09-03,338252,"Easy Coloring Books for Senior: Flowers and Animals Coloring Book Easy, Fun"
31620,renae_clair,2023-10-15,84675,Throw the Damn Ball: Classic Poetry by Dogs
33208,kwet6ylbrrk@deleted,2009-04-27,96934,Gallop - 9780761147633
36476,cambt3,2016-09-13,340232,Charmed Book Of Shadows With ORIGINAL PAGES In English - BIG Size Halloween
36674,kwet6ylbrrk@deleted,2022-11-09,396988,TODDLER BOARD BOOKS **BABIES LOVE**FINGER PUPPET**LIFT A FLAP** YOU CHOOSE!
36824,cambt3,2022-02-12,213671,Lilian Jackson Braun THE CAT WHO Book Series Lot - Choose - Build a Collection
38241,jacobs68,2023-05-27,46741,"Little Blue Truck's Halloween: A Halloween Book for Kids by Schertle, Alice"
39574,cambt3,2017-06-08,288132,Corduroy's Christmas - School & Library Binding
41417,kwet6ylbrrk@deleted,2007-07-15,390331,Puppy Dog Pals Puppy Dog Pals Mission: Fun: A Lift-the-Flap Book
41939,kwet6ylbrrk@deleted,2019-03-13,119170,Creepy Creatures: A Graphic Novel (Goosebumps Graphix #1): Volume 1
42556,cambt3,2015-11-28,376877,Pete the Cat: Trick or Pete
43154,kwet6ylbrrk@deleted,2023-07-17,388483,Disaster on the Titanic (Ranger in Time #9)
43595,kwet6ylbrrk@deleted,2017-05-22,60828,Sharks (Usborne Lift-the-Flap Learners)
45673,jacobs68,2023-12-02,311870,We're Going on a Bear Hunt
46258,renae_clair,2020-12-14,131154,Animal Babies (Nature Club)
47505,kwet6ylbrrk@deleted,2013-05-11,74704,Angelina at the Palace (Angelina Ballerina)
47827,jacobs68,2021-08-28,299257,Alligator Baby
48692,kwet6ylbrrk@deleted,2017-10-09,279672,The Call of the Wild and White Fang (Sterling Unabridged Classics)
50168,cambt3,2022-05-22,281957,Pete the Cat and the Supercool Science Fair
50479,kwet6ylbrrk@deleted,2021-04-13,126713,The Thingamabob
50567,jacobs68,2021-07-06,317048,Turtles & Snails (First Discovery) - Spiral-bound
51159,jacobs68,2002-06-28,50963,Tree in the Trail
52070,maryann774,2016-10-01,335127,Zootopia Junior Novelization (Disney Zootopia)
52318,kwet6ylbrrk@deleted,2016-05-18,161880,Doodled Cats: Dozens of clever doodling exercises ideas for cat pe
53465,jacobs68,2023-12-08,296797,"Hoot - Carl Hiaasen, 0375821813"
54553,renae_clair,2006-04-13,23276,How Animals Care for Their Babies (Books for Young Explorers)
55537,jacobs68,2022-05-25,21980,"Leroy Ninker Saddles Up: Tales from Deckawoo Drive, Volume One"
55910,maryann774,2013-04-01,800,"Chicken Soup for the Soul: The Magic of Cats: 101 Tales of Family, Friend"
56029,cambt3,2008-04-30,363620,Magic Tree House Books 1-28 Choose Brand New Latest Edition Flat $4.75 Shipping
56242,kwet6ylbrrk@deleted,2023-11-02,191897,Who Would Win Rhino vs. Hippo
57971,kwet6ylbrrk@deleted,2017-06-04,74427,The Bad Guys in the Furball Strikes Back; t
58280,kwet6ylbrrk@deleted,2022-01-05,250777,Horton Hears a Who!
58895,jacobs68,2016-05-02,139050,The Berenstain Bears Meet Santa Bear (Deluxe Edition) (First Time Books(R)) by B
60752,jacobs68,2023-10-25,243802,My First Counting Book
62404,renae_clair,2014-07-26,86223,"Warriors #1: Into the Wild [Warriors: The Prophecies Begin, 1] , Hunter, Erin"
63442,jacobs68,2021-06-20,307375,"One Fish, Two Fish, Three, Four, Five Fish (Dr. Seuss Nursery Collection)"
63874,maryann774,2016-06-10,381166,Biscuit and the Little Llamas (My First I Can Read)
65167,kwet6ylbrrk@deleted,2023-12-15,151199,Just So Stories (Puffin Classics)
67912,kwet6ylbrrk@deleted,2023-02-03,97299,Splat the Cat
69506,renae_clair,2017-09-19,4104,I Am Going! (An Elephant and Piggie Book)
69721,maryann774,2022-06-21,333400,"Wild Cats!; Wild Kratts; Step into Reading - 1101939141, Chris Kratt"
70465,kwet6ylbrrk@deleted,2023-05-03,58022,Llama Llama Red Pajama
70540,cambt3,2022-01-07,314776,My Life as a Book (The My Life series)
70783,renae_clair,2021-05-20,54258,"NEW LISTINGBlue Animals by Leaf, Christina"
71782,cambt3,2012-05-29,207504,The Berenstain Bears and the Big Blooper
74123,maryann774,2019-09-01,280506,"Hello, Farm!: Lift-a-sound (Lift-A-Sound Board Book)"
74415,cambt3,2023-02-02,224997,Tickle Time!: A Boynton on Board Board Book
74843,jacobs68,2020-06-13,250349,What If You Had Animal Feet?
75285,maryann774,2018-05-27,370966,"Happy Halloween, Biscuit!"
75399,cambt3,2021-07-12,142574,Home Is Where the Heart Is (1) (Good Dog)
76887,jacobs68,2021-06-03,271093,Piggie Pie!
77166,maryann774,2004-12-06,369185,The Berenstain Bears and the Trouble at School
80061,maryann774,2009-02-10,7269,How Rocket Learned to Read
82730,jacobs68,2019-05-28,264171,Scaredy Squirrel Has a Birthday Party
83566,jacobs68,2016-07-05,233972,"Seashells, Crabs and Sea Stars: Take-Along Guide [Take Along Guides]"
84094,renae_clair,2016-07-18,213198,"Rainforest Escape: My Island Animal, Exotic Flower and Tropical Plant Color Book"
84558,kwet6ylbrrk@deleted,2023-12-27,373154,"Inside of a Dog: What Dogs See, Smell, and Know"
85004,renae_clair,2019-08-07,150321,"Llama Llama Gives Thanks by Dewdney, Anna"
85808,kwet6ylbrrk@deleted,2023-12-11,132060,Teeth Tails and Tentacles: An Animal Counting Book
86414,jacobs68,2022-07-23,152716,A Peterson Field Guide to Wildflowers: Northeastern and North-Central North
86546,renae_clair,2023-09-12,5219,"I Love You, Grandma"
87997,cambt3,2023-11-26,43787,"NEW LISTINGMigloo's Weekend by Bee, William"
89303,cambt3,2008-09-19,154296,Paw Patrol Phonics Childrens Step Reading Books Beginning Readers Lot 12
89458,jacobs68,2021-07-22,268419,Nickelodeon Paw Patrol - Search with Skye - Little First Look and Find
89960,jacobs68,2023-08-18,382092,Urchin and the Heartstone (The Mistmantle Chronicles)
90085,renae_clair,2009-11-24,244408,Snowflake (Breyer Stablemates)
91627,renae_clair,2012-11-30,322373,Amazing Animal Groups Books for Young Explorers
91731,kwet6ylbrrk@deleted,2021-08-22,371341,"Merry Christmas, Peppa! (Peppa Pig 8x8)"
92894,renae_clair,2018-12-22,269916,Silly Lullaby (Boynton on Board (Sandra Boynton Board Books))
93928,renae_clair,2020-12-20,234560,Wild Winter Creatures! (Wild Kratts) (Step into Reading)
94087,jacobs68,2013-05-22,222544,"I Love You, Stinky Face"
94211,cambt3,2022-05-11,359920,The New Yorker Book of All-New Cat Cartoons (New Yorker Series)
94603,maryann774,2022-12-21,696,"Hello, Baby Animals: A Durable High-Contrast Black-And-White Board Book for"
94932,cambt3,2008-09-10,33008,Social Animal
96863,cambt3,2017-07-27,100730,Grandma Wishes: Children's Board Book (Love You Always)
97106,maryann774,2012-02-07,167623,"Panda Bear, Panda Bear, What Do You See? Board Book"
98781,jacobs68,2023-07-15,13473,Bear Snores On (The Bear Books)
99106,kwet6ylbrrk@deleted,2023-12-03,117480,"Rabbits, Squirrels and Chipmunks: Take-Along Guide (Take Along Guides)"
99546,cambt3,2023-04-01,180290,The Foolish Tortoise (The World of Eric Carle)
100260,kwet6ylbrrk@deleted,2011-04-06,337371,"Building Small Barns, Sheds & Shelters"
100269,renae_clair,2021-02-01,90022,NEW LISTINGThe Velveteen Rabbit : The Classic Children's Book by Margery Williams (1958)
100374,kwet6ylbrrk@deleted,2021-05-18,16991,Drawing: Animals in Colored Pencil: Learn to draw with colored pencil step by st
100803,renae_clair,2014-09-28,330951,Lot of 10 Finger Puppet Board Books Lot Random
101520,maryann774,2020-05-03,340825,Night of the Zombie Zookeeper (Desmond Cole Ghost Patrol)
104081,kwet6ylbrrk@deleted,2018-05-26,208419,Warriors #1: Into the Wild (Warriors: The Prophecies Begin)
104168,jacobs68,2008-06-13,300471,That's Not My Puppy: Its Coat Is Too Hairy(Usborne Touchy-Feely Books)
104194,cambt3,2019-10-22,198332,The Story of Babar: The Little Elephant
106102,jacobs68,2010-12-30,259502,Mister Seahorse
106227,cambt3,2008-07-23,263537,"Skippyjon Jones, Class Action"
107349,jacobs68,2016-09-07,392377,Owl Babies
107472,kwet6ylbrrk@deleted,2004-12-05,97099,Horse Diaries #1: Elska - 9780375847325
108480,jacobs68,2013-09-17,92960,Happy Pig Day! (An Elephant and Piggie Book)
109888,jacobs68,2015-12-16,271791,The Berenstain Bears and the Missing Honey
110186,renae_clair,2021-04-30,266448,Quack! Quack!: These Baby Animals Can't Want to Meet You (Baby Touch an)
111407,jacobs68,2021-05-02,209791,The Berenstain Bears Get the Gimmies
111827,cambt3,2023-12-24,162166,"Slide and Find - Animals - 9780312499082, board book, Roger Priddy"
112065,maryann774,2022-05-14,136047,The Berenstain Bears Pirate Adventure
112424,maryann774,2009-02-16,360034,Animal World. 9781407550879
113240,kwet6ylbrrk@deleted,2015-12-09,385193,How to Tell If Your Cat Is Plotting to Kill You (The Oatmeal)
113851,kwet6ylbrrk@deleted,2022-11-21,166741,"Click, Clack, Ho! Ho! Ho! (A Click, Clack Book)"
114265,renae_clair,2022-12-12,148956,Bear Snores On (The Bear Books)
114499,kwet6ylbrrk@deleted,2022-04-23,272714,Gregor the Overlander
115213,kwet6ylbrrk@deleted,2023-10-12,41395,Good as Gold - Disneys Out and About With Pooh Volume 1
115416,jacobs68,2023-10-23,384512,"THE SUPER SIDE-QUEST TEST!: A BR , Flintham, Thomas"
117337,kwet6ylbrrk@deleted,2021-11-24,191569,NEW / VINTAGE 1990 TMNT Pop-Up Storybook /
118018,cambt3,2023-04-05,139670,Born Free: A Lioness of Two Worlds
118272,renae_clair,2011-02-11,332850,"Click, Clack, Ho! Ho! Ho! (A Click, Clack Book)"
118739,cambt3,2019-03-28,272292,The Wildwood Bakery: A Branches Book (Owl Diaries #7)
119526,kwet6ylbrrk@deleted,2020-06-14,361685,Shelby's Story: A Puppy Tale
120142,jacobs68,2017-09-09,314037,Monarch Butterfly
120384,kwet6ylbrrk@deleted,2023-07-13,100674,Pete the Cat and the Bedtime Blues
120438,renae_clair,2011-07-07,205959,Making Rounds with Oscar: The Extraordinary Gift of an Ordinary Cat
120529,cambt3,2017-08-11,336433,"Skippyjon Jones, Lost in Spice"
120564,kwet6ylbrrk@deleted,2021-09-23,220362,My Big Animal Book (My Big Board Books)
120643,kwet6ylbrrk@deleted,2022-01-28,4617,The Art of Racing in the Rain: A Novel
121425,kwet6ylbrrk@deleted,2014-11-22,348246,"Lot of 5 If You Give a Mouse A Cookie Series Books by Laura Numeroff ""RANDOM"""
122215,maryann774,2010-11-16,329687,Dont Let the Pigeon Drive the Bus
122875,cambt3,2016-11-25,218724,"Adult Coloring Books: Animal Mandala Designs and Stress Relie... by Summer, Jade"
123237,kwet6ylbrrk@deleted,2018-08-16,158886,The Story of Ferdinand
124518,jacobs68,2016-06-08,213249,You Loves Ewe! (A Yam and Donkey Book)
124856,cambt3,2012-05-01,242288,Animal World. 9781407550879
125543,jacobs68,2010-08-08,181244,"Adult Coloring Books: Animal Mandala Designs and Stress Relie... by Summer, Jade"
126042,jacobs68,2016-07-11,390028,National Geographic Readers: Koalas
128741,kwet6ylbrrk@deleted,2020-10-21,284525,Animal Friends (Little Golden Book)
129896,maryann774,2012-10-23,157262,Have Mercy!: Confessions of the Original Rock 'N' Roll Animal
130002,maryann774,2023-09-10,289612,Eyelike Stickers: Kittens
132161,kwet6ylbrrk@deleted,2021-12-24,204378,The New Friend (Hey Jack!)
132196,cambt3,2016-11-27,241101,"Leroy Ninker Saddles Up: Tales from Deckawoo Drive, Volume One"
132279,kwet6ylbrrk@deleted,2012-07-15,344867,Kappa FLOWERS To Color DESIGNER SERIES Adult Coloring Book
134819,jacobs68,2009-09-19,33925,"What the Animals Tell Me: Developin- 9780786862597, Sonya Fitzpatrick"
135007,renae_clair,2015-10-19,6837,"The Eighty-Dollar Champion: Snowman, The Horse That Inspired a Nation"
136672,maryann774,2013-08-21,315341,Because I Had a Teacher
139754,renae_clair,2023-06-02,47736,The Pout-Pout Fish
140808,jacobs68,2011-11-18,67647,Hokey Pokey Elmo (Sesame Street) (Big Bird's Favorites Board Books)
141525,maryann774,2023-12-09,213519,"Sandra Polley's Knitted Toys: Animals, Dolls and Teddies for All Ages"
141757,kwet6ylbrrk@deleted,2021-04-01,189345,The Cat Who Had 60 Whiskers
142620,renae_clair,2020-12-31,112125,Thanksgiving Cats (Read with Me Cartwheel Books (Scholastic)
142950,renae_clair,2006-09-04,325306,The Bad Guys in Superbad (The Bad Guys #8)
143439,maryann774,2016-01-01,158054,The Life and Times of the Honeybee
143956,cambt3,2021-12-13,139533,The Self-Sufficient Backyard
145826,cambt3,2022-07-20,154010,Shark in the Park (Usborne Phonics Readers)
145841,jacobs68,2022-04-26,92877,Love That Dog
145964,maryann774,2023-10-23,277768,Arthur's First Sleepover: An Arthur Adventure
146127,kwet6ylbrrk@deleted,2023-07-24,236393,"NEW LISTINGRobbut, a Tale of Tails by Lawson, Robert"
146132,jacobs68,2020-05-09,89201,Pop-up Peekaboo: Woof! Woof!
147219,maryann774,2020-08-13,183554,The Trumpet of the Swan
148500,kwet6ylbrrk@deleted,2021-02-03,169576,"NEW LISTINGThe Animal Kids by Cauley, Lorinda Bryan"
149092,jacobs68,2022-06-24,292794,The Berenstain Bears and the Homework Hassle
149612,maryann774,2017-06-21,33001,Animal Dreams
149775,maryann774,2008-10-06,173066,"Llama Llama Jingle Bells - board book, 0451469801, Anna Dewdney, new"
149908,renae_clair,2013-02-12,369045,"Little Blue Truck's Springtime: An Easter And - Schertle, 0544938097, board book"
150343,cambt3,2021-02-23,281380,"Animal Tracks of Northern California by Sheldon, Ian"
150629,jacobs68,2007-10-10,222666,The Berenstain Bears and the Big Blooper
150749,jacobs68,2023-10-24,61570,Thereby Hangs a Tail: A Chet and Bernie Mystery (The Chet and Bernie Myst)
151269,maryann774,2022-04-05,79202,Everyone Poops (My Body Science)
151700,kwet6ylbrrk@deleted,2021-07-07,1613,Dream Snow
152510,cambt3,2023-06-04,375488,"I Need a Hug / Necesito Un Abrazo (Bilingual) by Blabey, Aaron"
153542,renae_clair,2015-12-01,150883,The Berenstain Bears Blaze a Trail
153777,jacobs68,2019-08-13,357186,Lights Out
153869,kwet6ylbrrk@deleted,2023-08-31,173582,The Bad Guys in The Furball Strikes Back (The Bad Guys #3)
154312,renae_clair,2019-11-04,374701,Captain Cat by Inga Moore
154633,maryann774,2001-05-19,195874,Teenage Mutant Ninja Turtles (Nickelodeon) Look and FindÂ® (Nickelodeon L
155068,kwet6ylbrrk@deleted,2021-11-23,10945,Religion Judaism Christianity Books & Bibles Choose from good titles List #2 L-Z
156041,maryann774,2023-10-18,97294,The Cat Who Dropped a Bombshell
156356,kwet6ylbrrk@deleted,2021-02-18,300117,"The King of Sting by Peterson, Coyote"
156703,cambt3,2008-05-23,337311,JUNIE B. JONES - Build-A-Lot by Barbara Parks
156800,maryann774,2017-11-24,192706,Random Lot of 10 Level 1 Step Into Reading | I Can Read | Learn To Read FOR BOYS
157210,cambt3,2019-10-07,28305,The Animals Bedtime Storybook
157784,kwet6ylbrrk@deleted,2023-03-13,387196,Purrmaids #4: Search for the Mermicorn
158120,maryann774,2016-08-13,162051,How to Draw 101 Animals
158523,jacobs68,2023-04-27,34899,The Three Bears
158524,renae_clair,2019-03-02,219388,Tog the Dog
161268,renae_clair,2019-12-04,290027,White Fur Flying
161451,kwet6ylbrrk@deleted,2012-04-14,229324,Animal Farm and Related Readings
163416,cambt3,2023-06-27,144495,Stallion in the Storm (Animal Ark Hauntings #1)
163579,maryann774,2020-04-28,265662,From Head to Toe Board Book
165690,kwet6ylbrrk@deleted,2008-06-22,189697,Peterson Field Guide Coloring Books: Birds: A Coloring Book [With Sticker(s)]
166173,renae_clair,2021-02-18,51142,Pearl's Ocean Magic (Dolphin School #1)
166860,maryann774,2021-04-26,385585,SHEEP IN A JEEP
167820,jacobs68,2012-06-03,312462,Fancy Nancy and the Posh Puppy
168540,renae_clair,2016-01-13,104667,"Inside of a Dog: What Dogs See, Smell, and Know"
168853,renae_clair,2016-02-08,132827,3 BEAUTIFUL STRESS RELIEF ADULT COLORING BOOKS U CHOOSE 1 OR ALL B-034
171023,jacobs68,2007-08-11,184460,Scaredy-Pug: A Branches Book (Diary of a Pug #5) (5)
171731,kwet6ylbrrk@deleted,2014-07-10,299058,Dora and the Unicorn King (Ready-To-Read Dora the Explorer - Level 1)
172345,cambt3,2023-11-27,306766,SAFARI: A PHOTICULAR BOOK
172923,jacobs68,2012-03-13,386361,The Ember Stone: A Branches Book (The Last Firehawk #1)
173785,kwet6ylbrrk@deleted,2019-11-29,18806,NEW LISTINGStillwater Trout by John Merwin
175287,jacobs68,2016-09-20,394820,Arctic Freeze (Race the Wild #3)
177996,cambt3,2018-04-01,223995,Everything for a Dog
178007,kwet6ylbrrk@deleted,2012-07-17,298031,Corduroy's Halloween (A Lift-the-Flap Book)
179394,cambt3,2023-05-27,62858,Farewell to Shady Glade
179628,kwet6ylbrrk@deleted,2021-06-13,213289,My Friend Rabbit: A Picture Book (Caldecott Medal Book)
179687,maryann774,2010-01-28,122569,Horse Diaries #1: Elska - 9780375847325
180246,cambt3,2023-12-29,343956,The Bad Guys in Open Wide and Say Arrrgh (The Bad Guys 15)
181655,kwet6ylbrrk@deleted,2023-04-11,357344,Pete the Cat's Train Trip (My First I Can Read)
182563,kwet6ylbrrk@deleted,2007-01-15,158235,Whistle for Willie
183459,kwet6ylbrrk@deleted,2020-04-23,122620,The Shy Little Kitten; Little Golden Books
183987,kwet6ylbrrk@deleted,2017-02-10,287656,Lectures on Human and Animal Psychology / by Wilhelm Wundt ; [Leather Bound]
185029,kwet6ylbrrk@deleted,2021-02-14,73498,Richard Scarry's Planes (Richard Scarry's Busy World)
185728,kwet6ylbrrk@deleted,2023-08-25,132308,"Smile, Pout-Pout Fish (A Pout-Pout Fish Mini Adventure)"
185883,maryann774,2016-07-08,242652,Little Puppy: Finger Puppet Book (Little Finger Puppet Board Books)
187107,kwet6ylbrrk@deleted,2015-08-06,309319,Everything for a Dog
187668,cambt3,2018-01-23,224824,"Seashells, Crabs and Sea Stars: Take-Along Guide [Take Along Guides]"
188181,kwet6ylbrrk@deleted,2015-06-21,329471,Sweet pickles books lot of 10 Small ASSORTED Alphabet Books Weekly Readers
189472,kwet6ylbrrk@deleted,2019-10-06,109030,Dog Man: From the Creator of Captain Underpants (Dog Man #1)
190092,cambt3,2021-03-31,29321,Charlotte's Web by E. B. White
190438,cambt3,2019-03-11,24613,The Three Snow Bears
190586,maryann774,2021-08-13,145125,Sheep Go to Sleep (board book) (Sheep in a Jeep)
191310,kwet6ylbrrk@deleted,2020-09-12,226446,Sleepy Dog (Step into Reading)
191661,jacobs68,2021-11-15,64847,Who Would Win? Ultimate Jungle Rumble
192378,kwet6ylbrrk@deleted,2017-10-18,13599,My First Peek-a-Boo Animals (The World of Eric Carle)
193503,cambt3,2020-06-07,235131,Is Your Mama a Llama?
193729,renae_clair,2013-08-17,354289,The Guardian
194675,kwet6ylbrrk@deleted,2023-01-24,69859,Winnie-The-Pooh Ser.: Now We Are Six & When We Were Very Young Classic Gift
194811,jacobs68,2022-12-31,84172,"Pete the Cat: Trick or Pete , Dean, Kimberly"
198224,maryann774,2022-06-03,222075,Bad Kitty Camp Daze
200170,kwet6ylbrrk@deleted,2018-01-15,323393,Samantha's Pride (Thoroughbred Series #7)
200711,jacobs68,2023-07-29,126055,Random Lot of 10 Level 2 Step Into Reading | I Can Read | Learn To Read FOR GIRL
202347,maryann774,2017-04-21,376945,"The Cat Who Went Underground - 9780515101232, Lilian Jackson Braun"
203684,kwet6ylbrrk@deleted,2013-06-11,359029,Cat Daddy: What the World's Most Incorrigible Cat Taught Me About Li
204303,cambt3,2019-04-26,142245,Sheep in a Jeep
204968,cambt3,2021-07-03,160931,Last Week Tonight with John Oliver Presents: A Day in the Life of Marlon Bundo
205164,jacobs68,2012-08-21,22325,An Otis Christmas
205477,maryann774,2023-03-22,237243,"George Washington and the General's Dog (Step-Into-Reading, Step 3)"
208824,renae_clair,2009-10-25,179856,Chadwick the Crab
209155,jacobs68,2022-02-19,341751,Where's the Poop?
210121,renae_clair,2019-08-18,39722,Maisy Makes Lemonade
210285,cambt3,2013-11-19,219951,"Hello Hello (Books for Preschool and Kindergarten, Poetry Books for Kids)"
211233,renae_clair,2006-07-17,374914,There Was an Old Lady Who Swallowed a Fly!
211717,maryann774,2013-09-12,259671,The Wonky Donkey: A Board Book
212353,kwet6ylbrrk@deleted,2023-01-25,268755,SCAREDY SQUIRREL
213134,jacobs68,2004-05-14,58736,Warriors: Power of Three #5: Long Shadows
214922,cambt3,2023-10-04,327391,Knight Owl
217311,jacobs68,2020-01-25,1346,NEW! DIARY OF A PUG Series 7 Books Set by Kyla May
218624,renae_clair,2014-10-20,271630,The Berenstain Bears' New Kitten (I Can Read Level 1)
219054,kwet6ylbrrk@deleted,2019-07-27,387522,Noisy Animals [My First]
221320,kwet6ylbrrk@deleted,2006-11-28,222909,Baby Orca: Finger Puppet Book
223061,cambt3,2020-06-06,254157,Chase's Space Case (Paw Patrol) (Step into Reading)
223354,renae_clair,2017-06-09,226076,McDuff Comes Home
224138,kwet6ylbrrk@deleted,2006-03-18,390884,Paw Patrol Phonics Childrens Step Reading Books Beginning Readers Lot 12
224343,maryann774,2010-04-11,92961,"First 100 Animals - 0312510799, board book, Roger Priddy"
224963,maryann774,2006-01-11,298970,Dora and the Unicorn King (Ready-To-Read Dora the Explorer - Level 1)
226620,jacobs68,2010-06-14,227456,NEW LISTINGLearn To Draw Animals
226698,kwet6ylbrrk@deleted,2023-06-28,232627,Pastured Poultry Profits
228270,cambt3,2022-08-26,356378,The Berenstain Bears and the Spooky Old Tree
229957,kwet6ylbrrk@deleted,2017-01-09,303025,"National Geographic Kids Everything Sharks: All the shark facts, photos"
230457,kwet6ylbrrk@deleted,2018-01-30,131326,PAW Patrol: The Movie: Big City Adventures (PAW Patrol) (Pictureback(R))
230948,renae_clair,2023-10-27,386885,Dog's Colorful Day
232018,renae_clair,2016-02-24,137688,"199 Dinosaurs and Prehistoric Animals - board book, 9780794542009, Hannah Watson"
232375,cambt3,2019-11-26,270176,The Haunted House (Choose Your Own Adventure - Dragonlarks)
232623,maryann774,2023-02-01,229421,Corduroy
232752,kwet6ylbrrk@deleted,2007-01-18,110412,The Magician's Elephant
232852,kwet6ylbrrk@deleted,2019-05-18,254842,Dora and the Unicorn King (Ready-To-Read Dora the Explorer - Level 1)
234538,kwet6ylbrrk@deleted,2012-10-07,1164,King & Kayla and the Case of the Secret Code
235902,kwet6ylbrrk@deleted,2001-10-11,155694,Duck on a Bike
236676,kwet6ylbrrk@deleted,2021-03-06,247522,Katie the Kitten
237150,maryann774,2017-07-18,265395,Eva and Baby Mo: A Branches Book; Owl Diaries #1
238224,maryann774,2022-02-04,377690,Farewell to Shady Glade
238540,cambt3,2022-01-12,10873,Kids Gone Fishin' (The Freshwater Angler)
238875,jacobs68,2016-12-09,379971,"Night-Night, Little Pookie (Pookie Books)"
239120,maryann774,2016-05-03,200791,Collie with a Card (Animal Ark Holiday Treasury #6-Valentine's Day) (Anim
240127,cambt3,2011-04-23,340645,Zen Shorts (Caldecott Honor Book)
240806,renae_clair,2004-04-04,106078,"Noisy Animals: My First Touch and Feel Sound Book by Walden, Libby"
240944,renae_clair,2022-04-07,276694,Surprises According to Humphrey
242262,maryann774,2022-02-06,11266,The Miraculous Journey of Edward Tulane
242819,jacobs68,2020-02-05,109716,Eloise and Friends
242954,kwet6ylbrrk@deleted,2006-10-15,103280,Odd and the Frost Giants
243389,jacobs68,2022-08-17,341449,"Steam Train, Dream Train"
243484,jacobs68,2004-12-19,159906,Tacky the Penguin
243855,kwet6ylbrrk@deleted,2017-04-02,251975,"Dogtripping: 25 Rescues, 11 Volunteers, and 3 RVs on Our Canine Cross-Cou"
244092,kwet6ylbrrk@deleted,2006-02-10,323629,SHEEP IN A JEEP
244328,renae_clair,2019-03-13,206362,The Adventures of Miss Petitfour
244536,maryann774,2007-10-27,114977,"The Art of Animal Drawing: Construction, Action Analysis, Caricature (Dov)"
245813,renae_clair,2012-10-31,244347,Bear Stays Up for Christmas
249656,kwet6ylbrrk@deleted,2011-08-16,64245,"Leroy Ninker Saddles Up: Tales from Deckawoo Drive, Volume One"
249700,renae_clair,2020-09-15,32464,The Wonderful World of Elephant and Piggie 10 Bks Box Set by Mo Willems - 4+ -PB
250026,kwet6ylbrrk@deleted,2013-07-28,75461,Chadwick the Crab
251087,renae_clair,2021-08-11,137053,I Lost My Tooth! (Unlimited Squirrels)
252741,jacobs68,2016-12-14,67532,If Animals Celebrated Christmas
252983,maryann774,2014-01-09,188463,Tuck in the Pool
253133,jacobs68,2020-02-14,293918,"Redwall by Jacques, Brian"
255134,kwet6ylbrrk@deleted,2022-06-17,121032,Eva's Big Sleepover: A Branches Book (Owl Diaries #9)
