id,username,review_time,book_id,title
493440,kwet6ylbrrk@deleted,2007-09-05,218279,Stallion by Starlight (Magic Tree House (R) Merlin Mission)
493462,kwet6ylbrrk@deleted,2007-11-27,356519,Bizzy Bear: Zookeeper
493614,maryann774,2021-10-15,384304,Crictor
494552,renae_clair,2009-06-24,1046,Cat in the Crypt (Animal Ark Hauntings #2)
497397,kwet6ylbrrk@deleted,2021-12-25,114732,All Better!
497881,cambt3,2014-05-31,27559,A Primates Memoir
498168,jacobs68,2020-09-28,370746,"NEW LISTINGMigloo's Weekend by Bee, William"
498309,jacobs68,2019-04-20,43588,Digital Download | Remarkably Bright Creatures: A Novel
500173,renae_clair,2015-07-22,227426,Horse Diaries #4: Maestoso Petra
500435,maryann774,2021-08-29,93727,Dr. Seuss's Horse Museum
500598,maryann774,2020-09-24,364013,The Berenstain Bears: We Love the Library
501741,kwet6ylbrrk@deleted,2022-06-09,37752,A Fly Went by (Beginner Books(R))
502038,jacobs68,2016-07-10,306776,The Kitten Who Thought He Was a Mouse (Little Golden Book)
502041,jacobs68,2013-01-08,29293,The Swiss Family Robinson (Puffin Classics)
502348,jacobs68,2005-05-13,156955,Dream Animals: A Bedtime Journey
503432,kwet6ylbrrk@deleted,2021-05-24,299123,The Velveteen Rabbit Mini Kit: Plush Toy and Illustrated Book (RP Minis) by in
503797,kwet6ylbrrk@deleted,2021-09-21,58085,Swimmy
504197,cambt3,2011-01-13,377195,Dog Man: From the Creator of Captain Underpants (Dog Man #1)
505073,kwet6ylbrrk@deleted,2022-05-27,130560,"The Quest Begins (Seekers, Book 1)"
505191,cambt3,2013-08-18,2525,Who Would Win? Ultimate Bug Rumble
505296,kwet6ylbrrk@deleted,2010-06-25,192593,Blind Trust (True Blue K-9 Unit) - Mass Market
506496,jacobs68,2020-02-03,313300,Close to Shore: The Terrifying Shark - 9780767904148
506523,cambt3,2023-03-11,387069,Doggies (Boynton on Board)
507127,jacobs68,2005-05-13,211791,Angry Birds Playground: Atlas: A Global Geography- 1426314000
507963,kwet6ylbrrk@deleted,2008-04-07,153085,"Polar Bear, Polar Bear, What Do You H- board book, Bill Martin Jr, 9780805053883"
508145,cambt3,2023-02-14,171190,The Shy Little Kitten (Little Golden Books)
508901,jacobs68,2022-08-27,279975,Chicken Soup for the Soul: Loving Our Dogs: Heartwarming and Humoro - ACCEPTABLE
509499,kwet6ylbrrk@deleted,2023-12-14,205246,Ember (Rescue Dogs #1)
509582,renae_clair,2008-06-07,302996,"NEW LISTINGMiss McTaffetys Cats by Underhill, Liz"
509996,jacobs68,2023-02-14,108774,Dog
510068,cambt3,2019-09-17,127199,SAFARI: A PHOTICULAR BOOK
511064,kwet6ylbrrk@deleted,2008-02-28,225795,"Hero by Morey, Walt"
513300,jacobs68,2008-04-14,171049,Kitty Feral and the Case of the Marshmallow Monkey
513546,cambt3,2004-02-22,167762,The Mitten
513561,maryann774,2014-09-20,22592,World of Eric Carle - Animal Tales Sound Storybook Treasury
513800,renae_clair,2012-06-30,259425,Shiloh (The Shiloh Quartet)
514233,renae_clair,2012-10-07,207708,The Poky Little Puppy (A Little Golden Book Classic)
515039,cambt3,2015-02-24,231511,Little Blue Truck's Springtime
515095,kwet6ylbrrk@deleted,2018-11-06,200889,"Bluey: Bob Bilby - Penguin Young Readers Licenses, 0593224590"
515117,kwet6ylbrrk@deleted,2021-05-16,161324,Big Chickens
517023,jacobs68,2021-09-03,144223,The Berenstain Bears and the Christmas Angel (Berenstain Bears/Living)
517195,renae_clair,2023-05-27,81429,"Polar Bear, Polar Bear What Do You Hear? sound book"
518221,cambt3,2022-01-31,392077,Animal Farm
518500,jacobs68,2017-03-06,85818,The One and Only Bob
518730,maryann774,2018-09-08,154266,Boxcar Children Books Gertrude Warner Mystery Chapter **Build Your Own Lot**
519953,jacobs68,2023-08-06,153321,The One and Only Ruby by Katherine Applegate
521264,cambt3,2023-12-12,108031,The Berenstain Bears and Too Much Vacation- 9780394830148
522365,kwet6ylbrrk@deleted,2010-04-26,201336,"Macca the Alpaca by Cosgrove, Matt"
525551,kwet6ylbrrk@deleted,2005-03-10,149811,The Berenstain Bears in the Dark (First Time Books)
525603,renae_clair,2023-11-04,71248,Pete the Cat and His Four Groovy Buttons
526600,cambt3,2007-07-27,203562,"Animals at War (Usborne Young Reading: Series Three) by Isabel George, Rob Lloyd"
526670,cambt3,2010-03-09,339676,Wild Predators (Wild Kratts) (Step into Reading)
526742,renae_clair,2022-01-23,204527,"Fishing for Catfish: The Complete Guide for Catching Big Channels, Blues"
526909,kwet6ylbrrk@deleted,2004-01-21,37375,Mothering Heights + 9 Dog Man books by Dav Pilkey
528579,maryann774,2021-09-18,361660,If Animals Kissed Good Night
529640,jacobs68,2023-09-27,241277,Mammal (Eyewitness Books)
530003,kwet6ylbrrk@deleted,2015-10-17,6174,NEW LISTINGMiss Bindergarten Gets Ready for Kinderg
530206,renae_clair,2009-01-17,368789,The Secret Zoo: Secrets and Shadows
530632,maryann774,2020-11-03,177302,"NEW LISTINGLogolounge Master Library, Volume 2: 3000 Animal and Mythology Logos"
531050,kwet6ylbrrk@deleted,2016-03-22,156127,All I Know About Animal Behavior I Learned in Loehmann's Dressing Room
531127,kwet6ylbrrk@deleted,2021-08-15,284886,NEW & SEALED 6 Books There Was An Old Lady Who Swallowed a Fly Frog Bat Colandro
532497,cambt3,2023-03-17,301142,The Berenstain Bears' New Baby
534938,kwet6ylbrrk@deleted,2019-10-01,264842,Ice Dogs
535296,cambt3,2023-11-10,99093,My Big Animal Book
535709,kwet6ylbrrk@deleted,2015-10-05,135976,Lot Of 5 Finger Puppet Board Books Lot Random
535818,renae_clair,2023-01-08,307434,DK Eyewitness Books: Horse
536759,maryann774,2019-11-23,176904,Your Baby's First Word Will Be DADA
537373,jacobs68,2018-01-08,74888,The Mitten
537881,kwet6ylbrrk@deleted,2023-02-19,204227,"The Hummingbird Book: The Complete Guide to Attracting, Identifying, and"
539145,kwet6ylbrrk@deleted,2021-07-04,109586,The Story of Ferdinand
539307,kwet6ylbrrk@deleted,2023-08-03,96702,Tabbed Board Books: My First Animals: Let's Squeak and Squawk! (Tab Board)
539743,cambt3,2019-01-15,101732,World of Reading: Mother Bruce Bruce's Big Fun Day: Level 1
540919,jacobs68,2005-05-03,245670,"Hello, Crabby!: An Acorn Book (A Crabby Book #1)"
542649,kwet6ylbrrk@deleted,2021-05-26,278246,Kira's Animal Rescue (Girl of the Year)
542694,cambt3,2022-11-08,261957,Patrol Pals (Paw Patrol) (Friendship Box)
546137,jacobs68,2022-01-19,29296,"Rumor Has It; An Animal Magnetism Novel - Jill Shalvis, 9780425255827"
547189,maryann774,2013-03-28,31870,"Does a Kangaroo Have a Mother, Too?"
547606,maryann774,2019-04-03,48757,Carl's Masquerade
548854,maryann774,2021-07-16,134986,Baby Touch and Feel: Baby Dinosaur (Baby Touch & Feel)
549281,kwet6ylbrrk@deleted,2011-04-08,272625,Bear Wants More
550236,cambt3,2022-01-02,133800,The Cat Who Wasn't There
550687,cambt3,2022-07-06,214412,Janey Crane (Let's Read Together)
552523,maryann774,2021-01-05,387299,The Miraculous Journey of Edward Tulane by Kate Dicamillo
553124,renae_clair,2023-02-09,154760,The Umbrella
554938,renae_clair,2017-12-12,363808,"An Elephant & Piggie Biggie! by Willems, Mo"
554960,kwet6ylbrrk@deleted,2017-03-30,287878,Corduroy's Christmas - School & Library Binding
555238,maryann774,2019-03-31,339792,"Jack Hanna's Big Book of Why: Amazing Animal Facts and Photos by Hanna, Jack"
555250,maryann774,2014-08-21,128165,Marley & Me: Life and Love with the World's Worst Dog
557631,renae_clair,2017-10-28,176696,Literature Classics Build Your Own Lot You Choose The Books For Decor/Library
558153,jacobs68,2019-02-08,115839,Pete the Kitty and the Unicorn's Missing Colors (My First I Can Read)
558500,kwet6ylbrrk@deleted,2016-02-12,329380,A Horse for Kate (Horses and Friends)
559674,kwet6ylbrrk@deleted,2019-07-11,392198,National Geographic Readers: Adorable Animals (Level 2) [PREMIUM LEATHER BOUND]
561413,maryann774,2013-09-06,39186,Birds (National Audubon Society First Field Guides)
563104,kwet6ylbrrk@deleted,2023-04-26,237688,How to Draw Zoo Animals: Step-by-step instructions for 20 wild creatures .. NEW
563462,jacobs68,2023-01-29,403129,The Babies and Doggies Book
563558,kwet6ylbrrk@deleted,2008-11-19,243369,"Big Egg (Step-Into-Reading, Step 1)"
563938,kwet6ylbrrk@deleted,2013-06-07,383499,The Perfect Horse: The Daring U.S. Mission to Rescue the Priceless Stalli
564376,cambt3,2019-03-27,84773,Animales Nocturnos (Night Animals) (Spanish Edition) by Gianna Marino
565393,jacobs68,2008-05-12,201901,Halloween Heroes! (Paw Patrol)
567327,maryann774,2019-06-10,136693,Spot's Peekaboo
568400,cambt3,2022-08-12,241651,Three Little Kittens (Folk Tale Classics)
568684,jacobs68,2010-08-11,165100,Don't Let The Pigeon Drive The Bus! - 9780439686174
569005,kwet6ylbrrk@deleted,2008-08-11,31190,Adult Coloring Book: Stress Relieving Animal Designs
569517,kwet6ylbrrk@deleted,2020-08-22,162799,"Millions of Cats by Gág, Wanda"
569610,jacobs68,2022-12-27,45937,Pete the Cat: Out of This World
569981,renae_clair,2016-03-02,236977,Dog Man: Brawl of the Wild: A Graphic Novel (Dog Man #6): From the Creator of
572139,kwet6ylbrrk@deleted,2022-11-12,13988,Wild Robot Protects
572889,maryann774,2017-01-08,99951,Squirreled Away (The Dead Sea Squirrels)
573981,maryann774,2021-11-11,74348,The Wonderful World of Elephant and Piggie 10 Bks Box Set by Mo Willems - 4+ -PB
576340,kwet6ylbrrk@deleted,2022-05-04,317839,No Roses for Harry!
576381,jacobs68,2022-08-09,241558,Last Week Tonight with John Oliver Presents: A Day in the Life of Marlon Bundo
578284,renae_clair,2020-12-31,118130,"Click, Clack, Ho! Ho! Ho! (A Click, Clack Book)"
578957,kwet6ylbrrk@deleted,2021-06-07,143300,Pete the Cat: Secret Agent
579232,renae_clair,2022-01-28,316495,Arthur Decks the Hall (Nifty Lift-and-Look)
579263,maryann774,2013-04-24,327221,Whisker Haven Tales with the Palace Pets:: Sticker Storybook
579596,kwet6ylbrrk@deleted,2016-12-16,279134,Paw Patrol Phonics Box Set
580813,renae_clair,2016-01-05,377143,Pete the Cat Checks Out the Library
580962,cambt3,2013-03-04,54275,"NEW LISTINGDogs & Puppies: Learn to Draw and Color 25 Favorite Dog Breeds, Step by Easy"
581683,kwet6ylbrrk@deleted,2017-02-02,376862,"Eona by Goodman, Alison"
581776,maryann774,2021-12-10,323838,Animal Farm
582026,kwet6ylbrrk@deleted,2023-05-10,115662,What If You Had An Animal Tail? - 1338208780
584938,jacobs68,2023-06-21,97718,Noisy Animals [My First]
585557,cambt3,2023-03-09,395250,Dr. Seuss's Horse Museum
585612,kwet6ylbrrk@deleted,2020-08-22,49469,Pets Are for Keeps (Animal Inn)
586696,kwet6ylbrrk@deleted,2018-03-14,162772,Coloring Books for Kids Toddlers Super Cute Animals Coloring
586884,cambt3,2015-11-08,134807,"Gobble, Growl, Grunt"
586971,maryann774,2023-06-12,190966,Animal-Speak: The Spiritual & Magical Powers of Creatures Great & Small
587412,maryann774,2003-04-21,351555,Peter Rabbit Large Shaped Board Book
587926,jacobs68,2021-08-16,293184,The Cricket in Times Square (Chester Cricket and His Friends)
590529,cambt3,2017-03-18,314955,Flora and Ulysses: The Illuminated Adventures
590698,cambt3,2020-06-08,244865,"Easy Coloring Books for Senior: Flowers and Animals Coloring Book Easy, Fun"
590733,maryann774,2011-07-26,257116,"Go, Stitch, Go! (Step-Into-Reading, Step 2)"
591703,maryann774,2023-12-08,393096,Toot & Puddle
591950,kwet6ylbrrk@deleted,2019-12-02,51107,The Big Book of Berenstain Bears Beginner Books
592802,kwet6ylbrrk@deleted,2008-04-08,29819,Llama Llama Holiday Drama
592887,cambt3,2023-02-17,161448,Purrmaids 6: Quest for Clean Water
593430,kwet6ylbrrk@deleted,2019-09-16,277943,CHRISTMAS IN THE MANGER
594014,maryann774,2004-11-04,16125,If You Give a Dog a Donut
594170,renae_clair,2016-05-23,188805,The New Yorker Book of All-New Cat Cartoons (New Yorker Series)
594415,cambt3,2019-10-23,47349,"Bad Dog, Marley!"
595293,jacobs68,2018-08-18,256011,Llama Llama Misses Mama
595563,jacobs68,2019-06-27,388002,I Love You to the Moon and Back by Amelia Hepworth (English) Board Books Book
595846,kwet6ylbrrk@deleted,2023-03-11,97604,Just a Mess (Little Critter) (Look-Look)
597588,maryann774,2010-01-13,129524,Stellaluna
599213,maryann774,2018-11-08,287952,Busy Doggies!: A Busy Animals Book (A Busy Book)
599488,kwet6ylbrrk@deleted,2022-04-06,275507,"Share Some Kindness, Bring Some Light"
599945,cambt3,2013-02-08,109676,Splat the Cat: I Scream for Ice Cream (I Can Read Level 1)
600021,kwet6ylbrrk@deleted,2009-08-06,18382,"Draw 50 Animals: The Step-by-Step Way to Draw Elephants, Tigers, Dog"
601428,jacobs68,2018-02-11,328833,Little Puppy: Finger Puppet Book (Little Finger Puppet Board Books)
601512,cambt3,2017-08-17,272327,I'm a Narwhal (Little Golden Book)
602415,jacobs68,2022-02-23,55617,"Go, Dog. Go!: P.D. Eastman's Book of Things That Go"
602867,renae_clair,2020-01-01,399287,"Draw 50 Animals: The Step-by-Step Way to Draw Elephants, Tigers, Dogs, Fi"
604357,jacobs68,2019-05-25,106766,Scaredy Squirrel Prepares for Christmas: A Safety Guide for Scaredies
604883,maryann774,2018-10-06,170925,How Animals Care for Their Babies (Books for Young Explorers)
