id,username,review_time,book_id,title
255299,jacobs68,2018-12-02,273949,Purrmaids #4: Search for the Mermicorn
257775,kwet6ylbrrk@deleted,2020-10-05,76315,The Wild Unknown Animal Spirit Deck and Guidebook (Offic [PREMIUM LEATHER BOUND])
258015,jacobs68,2015-05-01,65031,"The Hummingbird Book: The Complete Guide to Attracting, Identifying - ACCEPTABLE"
258580,maryann774,2013-06-22,78748,Guess How Much I Love You
258875,kwet6ylbrrk@deleted,2019-10-15,293565,Pete the Cat: Secret Agent
259286,renae_clair,2021-06-20,344854,"Adult Coloring Book: Stress Relieving Designs Animals, Mandalas, Flowers"
260452,maryann774,2022-03-04,350766,Nickelodeon 5-Minute Christmas Stories (Nickelodeon)
261182,maryann774,2019-05-11,64728,Funny Farm Animals - Silicone Touch and Feel Board Book - Sensory Boa
262115,renae_clair,2021-06-14,22971,Pete the Kitty and the Unicorn's Missing Colors (My First I Can Read)
263311,jacobs68,2021-08-14,159890,This Book Is Literally Just Pictures of Animals Silently Judging You
264705,cambt3,2012-11-08,401661,National Geographic Kids Chapters: Lucky Leopards: And More True Stories
265087,jacobs68,2016-05-28,9614,There Was an Old Lady Who Swallowed a Fly!
265240,kwet6ylbrrk@deleted,2014-09-16,282815,Purrmaids 6: Quest for Clean Water
265959,jacobs68,2007-08-28,145145,Warriors: The New Prophecy #3: Dawn
266377,kwet6ylbrrk@deleted,2023-10-05,14039,"NEW LISTINGHorse, Follow Closely: Native American Horsemanship by Pony Boy, Gawani"
266558,renae_clair,2018-01-21,265251,Waiting Is Not Easy! (An Elephant and Piggie Book)
266733,kwet6ylbrrk@deleted,2016-05-15,82588,Mac and Cheese [I Can Read Level 1]
267282,jacobs68,2013-06-09,385966,The Three Bears
272736,maryann774,2018-10-21,401505,"Cleveland Amory's Compleat Cat: Cat Who Came for C- Amory, 1884822282"
273413,cambt3,2022-05-24,383566,"Panda Bear, Panda Bear, What Do You See? Board Book"
273818,maryann774,2019-11-10,28320,Animalium Botanicum: Deluxe Two-Book Box Set - LIKE NEW
273948,cambt3,2016-09-27,282012,Night Animals by Gianna Marino
273998,kwet6ylbrrk@deleted,2019-11-08,205939,"Rumor Has It; An Animal Magnetism Novel - Jill Shalvis, 9780425255827"
274066,cambt3,2015-11-19,317979,Wild Animals Coloring Book (Dover Nature Coloring Book)
276203,maryann774,2011-05-23,272585,National Geographic Little Kids First Big Book of Animals (National Geogr)
276783,maryann774,2009-09-10,248058,Mariel of Redwall
276906,renae_clair,2016-06-12,116210,Shark Trouble
277727,kwet6ylbrrk@deleted,2016-10-21,400706,Blueberries for Sal (Viking Kestrel picture books)
279047,maryann774,2005-04-09,372336,All Better!
279430,cambt3,2016-05-19,337787,Is Your Mama a Llama?
279995,cambt3,2022-07-10,288159,World of Reading: Mother Bruce Bruce's Big Fun Day: Level 1
280229,jacobs68,2012-10-25,63042,Bear Stays Up for Christmas; The Bear Bo- 9781416958963
280816,maryann774,2021-12-03,67278,Dogs (First Discovery Book) - Spiral-bound
281954,jacobs68,2003-03-26,99743,Pig the Elf (Pig the Pug)
282874,cambt3,2020-08-30,223666,Wild About Books
282934,renae_clair,2020-05-17,348904,Infected: An AFK Book (Piggy Original Novel)
284894,cambt3,2019-05-24,243439,Katt vs. Dogg
285342,kwet6ylbrrk@deleted,2023-08-14,12375,"A Big Guy Took My Ball!-An Elephant and Pi- 9781423174912, Mo Willems"
285820,maryann774,2020-02-06,263915,The Pout-Pout Fish
287561,cambt3,2018-04-05,117834,The Lion Guard Meet the New Gu
288524,maryann774,2019-04-01,343794,"National Geographic Kids Everything Sharks: All the shark facts, photos"
288552,cambt3,2023-07-08,35803,The House That Jack Built
288620,kwet6ylbrrk@deleted,2018-05-03,194814,NEW LISTINGJunior Classics BLACK BEAUTY +THE SECRET GARDEN Anna Sewell
288761,kwet6ylbrrk@deleted,2019-05-10,279133,How Do Dinosaurs Love Their Dogs?
289289,jacobs68,2022-01-15,345245,THE BERENSTAIN BEARS TRICK OR TR
291340,renae_clair,2020-03-21,77461,Mad Dog (Starlight Animal Rescue) - Mass Market
291439,maryann774,2019-10-24,154024,Olivia Counts
291671,renae_clair,2015-07-07,346804,Pests: How Humans Create Animal Villains
291848,renae_clair,2022-11-25,328054,We're Going on a Bear Hunt (Classic Board Books)
292622,maryann774,2015-03-18,339704,The Call of the Wild
292863,maryann774,2016-05-15,252878,In the Heart of the Sea: The Tragedy of the Whaleship Essex
292886,cambt3,2022-12-11,152942,"Have You Seen My Cat? by Carle, Eric"
293401,kwet6ylbrrk@deleted,2023-05-25,135676,Echo's Lucky Charm (Dolphin School #2)
293769,maryann774,2008-11-11,311640,Saving Winslow
294067,cambt3,2021-12-27,156634,Super Rabbit Boy vs. Super Rabbit Boss!: A Branches Book (Press Sta)
294284,jacobs68,2016-08-15,281901,Corgi in the Cupcakes (Animal Ark Holiday Treasury #18-Valentine's Day)
296355,cambt3,2015-06-09,78247,The Dumb Bunnies
296939,maryann774,2017-05-31,340731,Eva in the Spotlight: A Branches Book (Owl Diaries #13)
297312,kwet6ylbrrk@deleted,2022-05-29,347895,The Cat Who Sniffed Glue
298743,kwet6ylbrrk@deleted,2014-06-25,266819,Animal artisans
299198,renae_clair,2019-02-02,133113,The Three Little Pigs (Disney Classic) (Little Golden Book)
299250,maryann774,2016-06-20,192304,The Call of the Wild
299825,maryann774,2021-01-09,376874,There Was an Old Lady Who Swallowed a Fly!
300241,cambt3,2017-01-01,238044,"NEW LISTINGHow to Build Animal Housing: 60 Plans for Coops, Hutches, Barns, Sh - ACCEPTABLE"
300558,maryann774,2010-03-03,376490,PIG THE PUG SIX Book BOXED SET Aaron Blabey Winner Star Elf Fibber NEW SEALED
300667,renae_clair,2018-01-11,108760,That's Not My Kitten... (Usborne Touchy-Feely Books)
300864,kwet6ylbrrk@deleted,2021-05-26,385991,"The Bad Guys in Open Wide and Say Arrrgh! [The Bad Guys #15] by Blabey, Aaron"
301574,jacobs68,2023-10-08,286254,Angry Birds Playground: Atlas: A Global Geography- 1426314000
303269,jacobs68,2012-08-02,146941,The Berenstain Bears and the Big Blooper
303360,jacobs68,2010-06-15,248857,The Berenstain Bears Meet Santa Bear (Deluxe Edition) (First Time Books(R)) by B
305752,kwet6ylbrrk@deleted,2011-02-12,246434,"Good Night, Good Night: The Original Longer Version Of The Going To Bed Boo"
306361,kwet6ylbrrk@deleted,2014-03-31,281701,The Berenstain Bears Go to School (First Time Books(R))
306884,jacobs68,2017-07-19,210457,Nora the Arctic Fox Fairy (the Baby Animal Rescue Faires #7): A Rainbow Magic
306951,kwet6ylbrrk@deleted,2022-09-18,143451,"Brown Bear, Brown Bear, What Do You See?"
307222,jacobs68,2020-06-30,394705,The Pout-Pout Fish
307466,cambt3,2023-04-18,328742,Baby Touch and Feel: Farm Animals (Baby Touch & Feel)
307572,cambt3,2018-03-14,365594,Baby Einstein: First Words
308100,jacobs68,2018-02-12,239724,Seekers #3: Smoke Mountain
310080,jacobs68,2019-07-27,175336,Henry and Mudge and the Funny Lunch Level 2 Reader (Henry and Mudge Ready)
311690,maryann774,2007-07-06,332122,Bad Kitty Goes to the Vet; classic black-and
312077,renae_clair,2021-10-02,134667,Mariel of Redwall
312111,kwet6ylbrrk@deleted,2023-11-24,89575,Paddington and the Christmas Surprise
313155,kwet6ylbrrk@deleted,2018-01-29,160948,Baby Animals Black and White
313190,kwet6ylbrrk@deleted,2016-09-21,272705,Birds First Discovery Books
313258,maryann774,2023-12-03,271106,Spot Goes to the Farm board book
313548,kwet6ylbrrk@deleted,2011-02-17,71520,"Little Blue Truck's Halloween: A Halloween Book for Kids by Schertle, Alice"
314797,jacobs68,2017-07-30,219663,NEW LISTINGAnimal Mouths
315460,kwet6ylbrrk@deleted,2007-08-18,222472,CatStronauts: Race to Mars
317177,cambt3,2023-09-11,172989,A Dog's Promise (A Dog's Purpose)
318160,maryann774,2004-10-18,260329,1001 Things to Spot in the Sea
318824,jacobs68,2022-02-18,288357,Silly Lullaby (Boynton on Board (Sandra Boynton Board Books))
319682,renae_clair,2022-05-11,239072,Open the Barn Door (A Chunky Book(R))
320621,renae_clair,2010-07-28,309804,Marley & Me: Life and Love with the World's Worst Dog
320842,maryann774,2012-05-18,103540,"Foxfire 3: Animal Care, Banjos and Dulcimers, Hide Tanning, Summer and Fa"
323828,kwet6ylbrrk@deleted,2021-01-17,263851,The Berenstain Bears Get the Gimmies
325188,jacobs68,2014-01-11,51464,I Spy Little Animals
325512,cambt3,2023-07-06,256264,Bedtime Bear (Touch and Feel Books)
325601,renae_clair,2013-11-02,162134,"The Backyard Bug Book for Kids: Storybook, Insect Facts, and Activities"
325809,maryann774,2023-12-02,57894,National Geographic Little Kids First Big Book
326128,kwet6ylbrrk@deleted,2020-11-16,43886,Grumpy Monkey
327549,kwet6ylbrrk@deleted,2018-08-03,373991,The Animal Farm Buttermilk Cookbook: Recipes and Reflections from a Small Vermo
328018,maryann774,2022-03-04,277610,"Smile, Pout-Pout Fish (A Pout-Pout Fish Mini Adventure)"
328986,kwet6ylbrrk@deleted,2021-07-25,372409,Warriors: The New Prophecy #3: Dawn
330968,renae_clair,2019-11-16,366058,"Have You Seen My Cat? by Carle, Eric"
331509,cambt3,2018-06-06,86243,A Whale of the Wild
332218,renae_clair,2023-07-23,259483,The Berenstain Bears No Girls Allowed
333136,maryann774,2019-12-04,306620,Five Silly Turkeys
333316,kwet6ylbrrk@deleted,2022-02-20,368518,"Rainforest Escape: My Island Animal, Exotic Flower and Tropical Plant Color Book"
334576,cambt3,2017-10-17,41492,The Octonauts and The Only Lonely Monster
335318,kwet6ylbrrk@deleted,2022-07-11,95923,"NEW LISTINGGolden Retrievers by Schuh, Mari C"
335860,renae_clair,2013-02-02,81581,Put Me in the Zoo (I can read it all by myself' Beginner Books) - ACCEPTABLE
336232,renae_clair,2015-04-27,42448,That's Not My Kitten... (Usborne Touchy-Feely Books)
337112,kwet6ylbrrk@deleted,2018-11-04,126475,Redwall: 30th Anniversary Edition - Mass Market
337183,cambt3,2002-02-26,166551,The One and Only Bob
338183,renae_clair,2022-01-01,257652,I Had a Black Dog - Flexibound
338674,cambt3,2013-02-19,18659,Pete the Cat: Out of This World
340110,jacobs68,2008-01-20,259178,Gilbert Goldfish Wants a Pet
342426,jacobs68,2021-11-17,73989,Kitty Feral and the Case of the Marshmallow Monkey
342561,jacobs68,2009-10-30,227590,Nugly
343410,kwet6ylbrrk@deleted,2021-09-11,22094,Esio Trot
344459,kwet6ylbrrk@deleted,2016-02-20,1894,"Dinosaurs to Dodos: An Encyclopedia of Extinct Animals by Lessem, Don"
346881,maryann774,2012-05-18,212417,A Wolf Called Wander
346998,jacobs68,2018-06-06,37035,The Napping House
350937,jacobs68,2011-08-10,119116,The Ugly Duckling (Caldecott Honor Book)
352821,kwet6ylbrrk@deleted,2017-06-14,220039,Animals in Winter (Let's-Read-and-Find-Out Science)
353461,kwet6ylbrrk@deleted,2020-02-18,277231,"Dog Man: A Graphic Novel (Dog Man #1): From the Creator of Captain Underpants, 1"
354554,kwet6ylbrrk@deleted,2010-07-22,173724,Lost in the Snow (Pet Rescue Adventures)
354555,kwet6ylbrrk@deleted,2014-11-07,191424,My Big Book of Beginner Books About Me (Beginner Books(R))
354606,kwet6ylbrrk@deleted,2007-09-14,3746,Doctor De Soto
354962,maryann774,2023-03-13,139510,Mad Dog (Starlight Animal Rescue) - Mass Market
355305,maryann774,2007-08-26,34461,Pete the Cat and His Four Groovy Buttons
355650,kwet6ylbrrk@deleted,2023-10-28,288617,"WILD BORN [SPIRIT ANIMALS, BOOK"
355849,kwet6ylbrrk@deleted,2023-05-06,348795,NEW LISTINGThe Case of the Scaredy Cats; An I C
356105,maryann774,2012-02-19,180994,Franklin's Blanket
357455,kwet6ylbrrk@deleted,2012-06-25,260067,Henry Huggins
357516,jacobs68,2020-06-18,145784,Nugly
360267,maryann774,2005-10-16,4930,Olivia Counts
360332,kwet6ylbrrk@deleted,2023-12-08,287862,"Richard Scarry's Good Morning, Busytown! by Scarry, Richard"
360685,maryann774,2012-11-10,121203,The Mixed-Up Chameleon by Eric Carle (1984-10-24)
361035,kwet6ylbrrk@deleted,2021-07-27,251584,Chadwick the Crab
361259,kwet6ylbrrk@deleted,2022-10-29,377864,WHAT IF YOU HAD AN ANIMAL TAIL?
364797,jacobs68,2021-02-27,57121,Crookedstar's Promise (Warriors Super Edition)
364810,maryann774,2015-11-13,95946,The Horsewoman
367819,kwet6ylbrrk@deleted,2017-05-06,179414,Where the Red Fern Grows - Mass Market
368110,renae_clair,2015-12-13,193627,"There Was an Old Lady Who Swallowed a Bell!- 9780545946155, board book, Colandro"
368721,cambt3,2021-01-17,214089,Baby Touch and Feel: Bible Animals (Baby Touch & Feel)
368949,cambt3,2022-06-12,248520,National Geographic Little Kids First Big Book of the Ocean (National Geo)
369154,renae_clair,2020-04-03,261635,The Berenstain Bears Go to School (First Time Books(R))
369441,jacobs68,2020-11-16,295758,Ashlyn's Unsurprise Party (Wellie Wishers)
372447,cambt3,2012-04-30,163538,Creepy Carrots!
372589,kwet6ylbrrk@deleted,2010-07-18,314029,1984 & Animal Farm Set by George Orwell - NEW
374877,jacobs68,2023-05-27,4853,Because I Had a Teacher
375712,kwet6ylbrrk@deleted,2020-09-05,174913,Bear Snores On
375775,renae_clair,2016-10-15,268138,Have Mercy!: Confessions of the Original Rock 'N' Roll Animal
375807,jacobs68,2018-01-13,59269,I Am Pusheen the Cat
377811,cambt3,2018-03-11,389911,The Hidden World of the Fox
379340,cambt3,2022-02-05,275296,Hank the Cowdog Ranch Life - Complete Series 5 Books
380312,kwet6ylbrrk@deleted,2012-12-27,23667,Llama Llama Red Pajama
382800,cambt3,2015-03-05,290527,Clifford's Christmas
382885,jacobs68,2023-11-19,127553,"The Cat Who Saw Red - Lilian Jackson Braun, 9780515090161"
383199,cambt3,2019-07-16,80151,National Geographic Readers: Koalas
383202,renae_clair,2018-09-17,346519,Everything You Need to Ace Science in One Big Fat Notebook: The Complete
384235,cambt3,2014-05-25,115984,Pay Dirt: A Mrs. Murphy Mystery
384300,renae_clair,2006-09-02,240955,The Happy Man and His Dump Truck (Little Golden Book)
384674,jacobs68,2018-11-10,223616,The Yearling (50th Anniversary Edition) - Mass Market
384823,kwet6ylbrrk@deleted,2023-06-28,226935,"Baby Touch and Feel: Farm Friends - 9781465416728, DK, board book"
385382,kwet6ylbrrk@deleted,2018-12-04,335441,Busy Doggies!: A Busy Animals Book (A Busy Book)
385444,maryann774,2017-01-23,179638,"NEW LISTINGLITTLE CELEBRATIONS, IN THE BACKYARD, SINGLE COPY, FLUENCY, STAGE 3A"
385448,renae_clair,2020-10-04,400534,"Time for Bed, Pete the Kitty: A Touch & Feel Book (Pete the Cat)"
385656,kwet6ylbrrk@deleted,2023-04-18,200634,Water Babies
387258,kwet6ylbrrk@deleted,2018-10-15,278325,Lot of 15 1st Grade AR Accelerated Reading RANDOM Picture Books RL Level 1.0-1.9
387641,jacobs68,2013-09-17,194664,"Bright Baby Touch & Feel Baby Animals; Bright- board book, 9780312498580, Priddy"
388071,kwet6ylbrrk@deleted,2015-11-10,337160,Growl! A Book About Bears (level 3) (Hello Reader)
388238,kwet6ylbrrk@deleted,2020-01-27,303206,Amazing Animal Groups Books for Young Explorers
388573,cambt3,2013-12-16,42535,The Three Snow Bears
388727,cambt3,2023-09-13,363810,The Berenstain Bears and the Christmas Angel (Berenstain Bears/Living)
389962,maryann774,2023-09-12,207456,Hallmark Itty Bittys Jack and the Beanstalk Stuffed Animal & Storybook Set
390120,jacobs68,2018-04-29,300053,"Animal Farm: The Graphic Novel by Orwell, George"
390629,jacobs68,2020-11-10,42856,Childcraft Books Complete Your Set Replacement 1981 You Pick Choose Volumes
392286,cambt3,2017-07-10,101107,Zen Ties
392635,kwet6ylbrrk@deleted,2020-02-18,183255,CatStronauts: Mission Moon
392722,renae_clair,2022-01-29,323058,The Grinny Granny Donkey
393365,jacobs68,2017-11-21,49597,Never Touch a Shark
395185,cambt3,2023-04-17,106797,Animal Quotations
395323,kwet6ylbrrk@deleted,2021-04-23,87705,Random Lot of 10 Level 3 Step Into Reading | I Can Read | Learn To Read FOR BOYS
395573,kwet6ylbrrk@deleted,2016-01-17,311224,Baby Animals (Little Golden Book)
395827,renae_clair,2005-09-15,217902,Pete the Cat and His Four Groovy Buttons
396328,kwet6ylbrrk@deleted,2012-02-24,234238,Library Book: Are You My Mother?
396391,maryann774,2023-10-14,294719,"I Need a Hug / Necesito Un Abrazo (Bilingual) by Blabey, Aaron"
396565,maryann774,2022-10-07,39443,The Mitten
397394,kwet6ylbrrk@deleted,2017-12-01,273359,"North American Wildlife: Birds Field Guide by Reader's Digest; Dolezal, Robert"
397777,jacobs68,2021-11-13,36768,Skippyjon Jones Snow What
398526,maryann774,2020-05-19,108591,Warriors #3: Forest of Secrets (Warriors: The Prophecies Begin)
398757,kwet6ylbrrk@deleted,2020-01-14,260650,"NEW LISTINGKitty's Magic: Star the Little Farm Cat by Moonheart, Ella"
399510,maryann774,2009-10-03,222731,Cracker!: The Best Dog in Vietnam
399571,renae_clair,2020-01-25,387860,"Pete the Cat: Rock On, Mom and Dad!"
399964,jacobs68,2022-07-27,303013,Bizzy Bear: Zookeeper
401630,kwet6ylbrrk@deleted,2023-01-13,217990,Where The Red Fern Grows
402359,cambt3,2012-12-02,253224,"A Big Guy Took My Ball!-An Elephant and Pi- 9781423174912, Mo Willems"
402624,renae_clair,2023-03-10,244715,Baby Einstein: First Words
402753,jacobs68,2023-11-04,339749,Animal Rescue Friends Volume 1 Epic
402881,renae_clair,2009-11-01,137814,Dream Animals: A Bedtime Journey
402993,kwet6ylbrrk@deleted,2022-06-07,23951,The Cat Who Went Bananas
403933,renae_clair,2014-11-24,115023,The Secret Life of Pets Little Golden Book (Secret Life of Pets)
404942,cambt3,2018-01-17,105019,Nuts to You
406247,kwet6ylbrrk@deleted,2017-05-12,202601,"The Big Honey Hunt, 50th Anniversary Edition (The Berenstain Bears)"
408086,cambt3,2014-02-07,341085,Urchin and the Heartstone (The Mistmantle Chronicles)
409546,kwet6ylbrrk@deleted,2023-10-06,340032,1984 & Animal Farm (Set of 2 Books) by George Orwell -NEW
410491,kwet6ylbrrk@deleted,2016-08-21,377126,"Llama Llama Gives Thanks by Dewdney, Anna"
410532,maryann774,2021-08-10,266067,NEW LISTINGDoves; A Complete Pet Owner's Manual - 0812018559
412596,kwet6ylbrrk@deleted,2015-09-06,268723,NEW LISTINGFind Your Animal: A Spiritual Guide to Self-discovery
413496,maryann774,2020-05-21,135481,A Bear Called Paddington
414519,renae_clair,2023-02-14,206857,The Rainbow Fish
416169,renae_clair,2013-12-20,353158,Cats Gone Bad
416661,renae_clair,2011-02-22,374341,Amelia Sparklepaw's Party Problem (Magic Animal Friends: Special Edition)
418721,kwet6ylbrrk@deleted,2023-12-10,96261,PIG THE PUG SIX Book BOXED SET Aaron Blabey Winner Star Elf Fibber NEW SEALED
418825,renae_clair,2021-02-27,204861,Evolutional Ethics and Animal Psychology (Classic Reprint)
419122,cambt3,2023-10-10,270966,"Max; Maximum Ride, Book 5 - James Patterson, 0316002895"
420779,kwet6ylbrrk@deleted,2020-02-26,388067,"Chickens by Miller, Sara Swan"
421810,renae_clair,2023-10-05,94703,Big Little Spies (A Paws & Claws Mystery) - Mass Market
422166,jacobs68,2023-08-03,169232,Actual Size
424275,cambt3,2023-11-19,363260,Peter Spier's Circus (A Picture Yearling Book)
424872,kwet6ylbrrk@deleted,2017-04-17,208003,Animalia
426460,cambt3,2018-07-30,77803,The New Yorker Book of All-New Cat Cartoons (New Yorker Series)
427189,maryann774,2013-04-24,402066,Reptiles and Amphibians of New Zealand (2019)
428133,maryann774,2023-11-14,96509,The Wild Robot Escapes
429181,maryann774,2005-11-24,239181,The Classic Treasury of Aesop's Fables
430585,maryann774,2022-05-09,51987,Biscuits Christmas Storybook Favorites Includes 9 Stories Plus Stickers
431136,maryann774,2008-08-13,137563,Eating Animals
432781,cambt3,2020-01-25,399280,"The Capture (Guardians of Ga'hoole, Book 1)"
432838,cambt3,2021-04-14,205537,National Geographic Kids Chapters: Horse Escape Artist: And More True Sto
433335,maryann774,2021-07-28,339459,Illustrated Treasury of Classic Animal Tales & Rhymes (Children's Illustrated)
433407,kwet6ylbrrk@deleted,2014-07-02,295912,Dr. Petty's Pain Relief for Dogs: The Complete Medical and Integrative Guide
434219,jacobs68,2023-04-26,70401,There Was an Old Lady Who Swallowed a Bell!
434790,kwet6ylbrrk@deleted,2019-10-27,169109,Kids Gone Fishin' (The Freshwater Angler)
435760,jacobs68,2023-03-21,253765,NEW LISTINGKaakuluk: Beluga Whales!
436384,renae_clair,2013-05-11,40448,The Council of Animals: A Novel
436865,kwet6ylbrrk@deleted,2006-04-13,228234,20 LBS of Childrens Baby Toddler Daycare Board Books Chunky Books RANDOM
437044,maryann774,2021-10-14,212397,Comet's Nine Lives
437642,kwet6ylbrrk@deleted,2009-05-25,208180,"Wild Sea Creatures: Sharks, Whales and Dolphins! (Wild Kratts) (Step into"
438246,renae_clair,2007-06-30,254970,War Animals: The Unsung Heroes of World War II
438506,kwet6ylbrrk@deleted,2018-01-13,142514,Sam and the Firefly
439174,cambt3,2007-07-07,8938,Eloise and Friends
440788,kwet6ylbrrk@deleted,2019-11-18,312186,Bear Stays Up for Christmas
442476,kwet6ylbrrk@deleted,2023-11-06,134789,The Animals' Christmas Eve (Little Golden Book)
442842,kwet6ylbrrk@deleted,2019-05-22,368009,"Sweet Dreams, Roo (Winnie the Pooh)"
444651,kwet6ylbrrk@deleted,2020-12-10,172050,"Poppy; Poppy, 3"
445516,kwet6ylbrrk@deleted,2022-01-02,190919,Don't Let The Pigeon Drive The Bus! - 9780439686174
446336,kwet6ylbrrk@deleted,2018-08-05,74084,Goodnight Moon
446566,cambt3,2023-06-03,267845,If You Give a Pig a Pancake
446578,renae_clair,2017-11-12,324522,NEW LISTINGSurvivors #1: The Empty City
446719,maryann774,2021-04-24,345382,The Dinky Donkey
447493,renae_clair,2023-12-31,228006,Chicken Sunday - 9780698116153
447769,maryann774,2008-02-05,203721,What Do People Do All Day?
448548,kwet6ylbrrk@deleted,2022-07-29,321069,Richard Scarry's Please and Thank You Book (Pictureback(R))
448594,kwet6ylbrrk@deleted,2012-03-06,3332,Dream Animals: A Bedtime Journey
449851,renae_clair,2006-11-26,253114,Guess How Much I Love You
450295,renae_clair,2023-07-17,277685,"Baby Beluga; Raffi Songs to Read - 9780517709771, board book, Raffi"
450481,kwet6ylbrrk@deleted,2015-01-28,195834,"Bad Dog, Marley!"
450579,renae_clair,2020-02-06,112771,All the Awake Animals Are Almost Asleep
451192,jacobs68,2010-06-12,77671,Gilbert Goldfish Wants a Pet
451981,maryann774,2023-03-02,180505,Farm Animals Coloring Book for Kids Beautiful +40 Pages Contain Simple and Some
453083,renae_clair,2001-09-07,383343,The Loop - Mass Market
454039,kwet6ylbrrk@deleted,2023-06-27,105162,"Animal Kingdom: Color Me, Draw Me (A Millie Marotta Adult Co)"
454114,jacobs68,2019-01-17,27346,Arthur's TV Trouble (An Arthur Adventure)
455303,jacobs68,2003-02-04,161763,The Cute Book
455350,cambt3,2022-09-14,91986,Animales Nocturnos (Night Animals) (Spanish Edition) by Gianna Marino
456025,maryann774,2017-03-03,24626,Animal Dreams
457743,cambt3,2017-07-31,80925,Bear Wants More (The Bear Books)
458400,renae_clair,2020-03-30,52932,The Genius of Birds
458474,renae_clair,2019-12-10,129168,Mossflower (Prequel to Redwall) - Mass Market
458606,kwet6ylbrrk@deleted,2023-01-21,247734,"1984, Animal Farm (Set of 2 Books) by George, Orwell"
459160,maryann774,2016-11-25,226069,"I'll Wait, Mr. Panda / Yo voy a esperar, Sr. Panda (Spanish Edition)"
459298,kwet6ylbrrk@deleted,2023-01-02,310358,"The Bad Guys in Open Wide and Say Arrrgh! (the Bad Guys #15) by Blabey, Aaron"
461130,renae_clair,2018-04-20,159804,The Squeaky Lion (Animal Tales) by unknown
461469,kwet6ylbrrk@deleted,2011-09-08,286617,Your Bedroom Is a Rainforest!: Bring Rainforest Animals Indoors with
462314,renae_clair,2023-09-03,266097,Pests: How Humans Create Animal Villains
463434,cambt3,2007-08-31,158317,1001 Animals to Spot (1001 Things to Spot)
464220,kwet6ylbrrk@deleted,2016-09-28,130437,Nuts to You
464510,maryann774,2015-07-03,297587,Animal Farm and Related Readings
466541,maryann774,2021-03-08,357771,Richard Scarry's Best Little Word Book Ever (Little Golden Book)
466708,renae_clair,2017-03-15,327640,I'm the Biggest Thing in the Ocean!
467069,maryann774,2022-12-14,213672,"National Geographic Kids Ocean Animals Sticker Activity Book: Over 1,000"
468162,maryann774,2017-10-02,71562,Magic School Bus Going Batty
468254,maryann774,2023-05-17,350669,Baby Very First Slide and See Animals
468690,kwet6ylbrrk@deleted,2013-03-24,77101,Trouble with Trolls
470372,kwet6ylbrrk@deleted,2013-06-01,167972,Pete the Cat: Five Little Ducks
470744,kwet6ylbrrk@deleted,2022-09-27,146865,"Wildlife Fact File, Complete Series In 3 Three Inch Binders"
471622,kwet6ylbrrk@deleted,2021-09-30,280803,The Berenstain Bears' New Kitten (I Can Read Level 1)
471722,kwet6ylbrrk@deleted,2015-12-01,54308,Eragon (Inheritance)
471890,jacobs68,2023-04-23,371865,Llama Llama Red Pajama
472118,kwet6ylbrrk@deleted,2003-06-01,77722,"Mammals: A Fully Illustrated, Authoritative and Easy-to-Use Guide (A Gold)"
475012,maryann774,2013-10-12,1890,Walrus vs. Elephant Seal (Who Would Win?) (25)
476991,cambt3,2004-12-07,17638,Llama Llama Hoppity-Hop
477412,cambt3,2023-08-17,48616,The Cat Who Went Bananas
478571,kwet6ylbrrk@deleted,2018-01-07,7255,The Shy Little Kitten (Little Golden Books)
479192,cambt3,2021-07-21,373177,NEW LISTINGLot of 8 PIG THE PUG books
479437,renae_clair,2012-01-18,16860,I Am a Bunny (A Golden Sturdy Book)
479552,kwet6ylbrrk@deleted,2014-06-16,347944,"Rescued: What Second-Chance Dogs Teach Us About Living with Purpose, Lovi"
480063,maryann774,2017-03-11,311744,Who Would Win? Alligator vs. Python
483027,kwet6ylbrrk@deleted,2019-05-05,388787,Some Babies Are Wild [Wildlife Picture Books]
483322,jacobs68,2016-05-03,166308,"NEW LISTINGCesar's Way: The Natural, Everyday Guide to- 0307337332, Cesar Millan"
484532,kwet6ylbrrk@deleted,2019-11-06,53690,Corgi in the Cupcakes (Animal Ark Holiday Treasury #18-Valentine's Day)
485267,maryann774,2008-11-11,377694,Wild About Books
485401,maryann774,2022-06-29,221587,Flora and Ulysses: The Illuminated Adventures
486466,kwet6ylbrrk@deleted,2023-09-08,282412,"The Quest Begins (Seekers, Book 1)"
487548,maryann774,2018-06-24,298984,Tippy Lemmey
487864,kwet6ylbrrk@deleted,2023-08-01,157834,Journey through Ash and Smoke (Ranger in Time #5)
487943,maryann774,2019-01-18,153559,The World According to Bob: The Further Adventures of One Man and His Str
488108,maryann774,2023-04-03,190873,"How to Talk to Your Cat About Gun Safety: And Abstinence, Drugs, Satanism"
489362,jacobs68,2021-02-27,348355,Random Lot of 10 A to Z & Calendar Mysteries by Ron Roy Scholastic
489601,kwet6ylbrrk@deleted,2022-12-11,394183,"NEW LISTINGKitty's Magic: Star the Little Farm Cat by Moonheart, Ella"
489663,jacobs68,2011-12-30,385685,Dick and Jane Fun Wherever We Are
490184,kwet6ylbrrk@deleted,2022-07-04,38528,"Does a Kangaroo Have a Mother, Too?"
491398,kwet6ylbrrk@deleted,2013-12-25,327659,Chicken Sunday - 9780698116153
492967,renae_clair,2014-12-18,190453,Muddle and Match Jungle Animals
